{
  "schema_version": "1.0",
  "semester": {
    "start_date": "2026-09-07",
    "end_date": "2026-09-27",
    "timezone": "Asia/Shanghai"
  },
  "periods": [
    {"index": 1, "start": "08:00", "end": "08:45"},
    {"index": 2, "start": "08:50", "end": "09:35"},
    {"index": 3, "start": "10:10", "end": "10:55"},
    {"index": 4, "start": "11:00", "end": "11:45"}
  ],
  "sources": [
    {"source_id": "pdf_page_001", "type": "pdf_page", "description": "official timetable"}
  ],
  "events": [
    {
      "id": "event_001",
      "title": "Machine Learning",
      "location": "Room A201",
      "segments": [
        {
          "id": "seg_001",
          "time": {"mode": "period", "weekday": 2, "start_period": 3, "end_period": 4},
          "weeks": [1, 3],
          "evidence": [{"source_id": "pdf_page_001", "description": "Tue P3-P4 grid block"}]
        }
      ]
    },
    {
      "id": "event_002",
      "title": "Corporate Finance",
      "location": "Room B102",
      "segments": [
        {
          "id": "seg_001",
          "time": {"mode": "absolute", "weekday": 1, "start": "14:00", "end": "15:30"},
          "weeks": [1, 2],
          "evidence": [{"source_id": "pdf_page_001", "description": "text block"}]
        }
      ]
    }
  ],
  "audit": {
    "visual_candidates": [
      {
        "id": "vc_001",
        "source_id": "pdf_page_001",
        "weekday": 2,
        "start_period": 3,
        "end_period": 4,
        "classification": "course",
        "matched_event_ids": ["event_001"]
      }
    ]
  }
}
